day,slot,card_id,category,depth,option_a,option_b,anchor
72,2,family-roots-m09,Family & Roots,medium,My family knows my real life,My family knows a curated version,false
72,3,daily-life-d02,Daily Life & Aesthetic,deep,I've never fully felt at home anywhere,I make anywhere feel like home fast,false
73,1,values-worldview-s07,Values & Worldview,surface,I admire conviction,I admire flexibility,false
73,2,money-resources-m10,Money & Resources,medium,Retiring early is the goal,Loving the work is the goal,false
73,3,phones-online-d03,Phones & Online Life,deep,Part of my online life I'd still hide from you,You could scroll anything of mine today,false
74,1,conflict-style-s08,Conflict Style,surface,Bickering means we're comfortable,Bickering means something's off,false
74,2,future-ambition-m09,Future & Ambition,medium,Supporting your dream could become my dream,I need a dream that's only mine,false
74,3,social-energy-d04,Social Energy,deep,"If we ended, losing shared friends would wreck me","If we ended, I'd grieve you, not the circle",false
75,1,inner-world-s06,Inner World & Reassurance,surface,Journaling or notes-app confessions: yes,My processing never hits paper,false
75,2,lifestyle-pace-m09,Lifestyle Pace,medium,I want a partner who pulls me out more,I want a partner who slows me down,false
75,3,family-roots-d05,Family & Roots,deep,I owe my family debts that aren't money,My ledger with family is clean,false
76,1,daily-life-s09,Daily Life & Aesthetic,surface,Music on at home always,Quiet at home mostly,false
76,2,sex-intimacy-m07,Sex & Intimacy,medium,My past gave me confidence here,My past gave me things to unlearn,false
76,3,conflict-style-d03,Conflict Style,deep,I'm afraid of becoming how my parents fought,My parents fought in ways I'd repeat,false
77,1,phones-online-s08,Phones & Online Life,surface,I follow exes: it's nothing,I unfollow exes: it's hygiene,false
77,2,romance-affection-m10,Romance & Affection,medium,Grand gestures move me,Grand gestures embarrass me,false
77,3,values-worldview-d04,Values & Worldview,deep,I believe people can fundamentally change,"I believe people mostly reveal, not change",false
78,1,social-energy-s09,Social Energy,surface,My people would say I'm the planner,My people would say I'm the joiner,false
78,2,future-ambition-m10,Future & Ambition,medium,Where I live in ten years is open,Where I live in ten years is decided,false
78,3,inner-world-d05,Inner World & Reassurance,deep,I hide sadness behind competence,My sadness shows whether I like it or not,false
79,1,lifestyle-pace-s12,Lifestyle Pace,surface,Busy season makes me sharper,Busy season runs me down,false
79,2,family-roots-m10,Family & Roots,medium,Holidays with your family sounds easy,Holidays with anyone's family takes negotiation,false
79,3,conflict-style-d04,Conflict Style,deep,Contempt has crept in before — I had to root it out,Contempt isn't my failure — mine is retreat,false
80,1,daily-life-s10,Daily Life & Aesthetic,surface,I notice when one thing moves,I would not notice a new couch,false
80,2,money-resources-m11,Money & Resources,medium,I'd support a partner through a broke season,I'd struggle supporting a partner financially,false
80,3,future-ambition-d04,Future & Ambition,deep,I could give up the spotlight version of my future,The spotlight version is non-negotiable,false
81,1,phones-online-s09,Phones & Online Life,surface,Memes are a love language,Memes are a distraction,false
81,2,sex-intimacy-m08,Sex & Intimacy,medium,I'd want us to talk about this side often,This side should mostly speak for itself,false
81,3,values-worldview-d05,Values & Worldview,deep,Forgiveness is something I owe people,Forgiveness is something people earn,false
82,1,romance-affection-s10,Romance & Affection,surface,The chase was the fun part,The comfort is the fun part,false
82,2,inner-world-m10,Inner World & Reassurance,medium,I trust slowly and all at once,I trust quickly and revocably,false
82,3,family-roots-d06,Family & Roots,deep,How I was loved as a kid limits how I love now,I love beyond how I was loved,false
83,1,social-energy-s10,Social Energy,surface,New city: meet people fast,New city: explore alone first,false
83,2,lifestyle-pace-m10,Lifestyle Pace,medium,My pace is a choice I'd defend,My pace is a habit I'd change,false
83,3,conflict-style-d05,Conflict Style,deep,I can forgive almost anything said in anger,Some things said in anger end it for me,true
84,1,daily-life-s11,Daily Life & Aesthetic,surface,Same ten meals forever,New recipe every week,false
84,2,money-resources-m12,Money & Resources,medium,Money fights are really about money,Money fights are really about power,false
84,3,future-ambition-d05,Future & Ambition,deep,Failing publicly is my deepest career fear,Never attempting is my deepest career fear,false
85,1,phones-online-s10,Phones & Online Life,surface,I'd post us early,I'd post us eventually,false
85,2,values-worldview-m10,Values & Worldview,medium,My values changed a lot in five years,My values have held steady for years,false
85,3,inner-world-d06,Inner World & Reassurance,deep,If you saw my 3am thoughts you'd worry,My 3am thoughts would mostly bore you,false
86,1,romance-affection-s11,Romance & Affection,surface,A planned date night weekly,A spontaneous date when it sparks,false
86,2,sex-intimacy-m09,Sex & Intimacy,medium,Feeling desired is how I feel loved,Feeling safe is how I feel desired,false
86,3,family-roots-d07,Family & Roots,deep,I'd want our kids to know where I came from,Parts of where I came from end with me,false
87,1,social-energy-s11,Social Energy,surface,Birthday: gathered and celebrated,Birthday: quiet and acknowledged,false
87,2,conflict-style-m10,Conflict Style,medium,I'd want us to have rules for fighting,Rules for fighting feel unnatural,false
87,3,future-ambition-d06,Future & Ambition,deep,A partner has dimmed my ambition before,A partner has ignited my ambition before,false
88,1,daily-life-s12,Daily Life & Aesthetic,surface,Host at mine,Meet me out,false
88,2,money-resources-m13,Money & Resources,medium,My money habits would survive an audit,My money habits need an amnesty,false
88,3,values-worldview-d06,Values & Worldview,deep,I'd want our kids raised with my values,I'd want our kids to build their own,false
89,1,phones-online-s11,Phones & Online Life,surface,Phone-free vacation sounds amazing,Phone-free vacation sounds fake,false
89,2,lifestyle-pace-m11,Lifestyle Pace,medium,A shared calendar sounds romantic,A shared calendar sounds suffocating,false
89,3,inner-world-d07,Inner World & Reassurance,deep,Healing made me softer,Healing made me harder,false
90,1,romance-affection-s12,Romance & Affection,surface,Love at first sight is real,"Love is built, not found",false
90,2,family-roots-m11,Family & Roots,medium,I want a family that looks like mine did,I want a family that fixes what mine got wrong,false
90,3,future-ambition-d07,Future & Ambition,deep,Ninety days in: I want to build toward something real with you,Ninety days in: I know this isn't my future,true
